{
  "schemaVersion": 1,
  "scope": "local",
  "runId": "install-plan-20260905-local",
  "sourceDigest": "075627de964370bc6c584e83aad7ecdc8f9720cb66c02ffcc1aaf8b127656637",
  "status": "PASS",
  "checks": [
    {
      "id": "foundation",
      "status": "PASS",
      "command": "make check",
      "artifact": "docs/evidence/install-plan-20260905-local/foundation.log",
      "sha256": "1b83a889e4ea8730b683ee87ad56bdc43bb45603a09523280258edfbb306bab6"
    },
    {
      "id": "install-plan-unit",
      "status": "PASS",
      "command": "go test -race -count=1 -json ./internal/installplan ./cmd/wrctl",
      "artifact": "docs/evidence/install-plan-20260905-local/install-plan-unit.log",
      "sha256": "947a52e826bd2fd99322bfc9765216bc67d8fd175c819f6e3a1738f46106e960"
    },
    {
      "id": "install-plan-repeat",
      "status": "PASS",
      "command": "go test -race -count=3 ./internal/installplan ./cmd/wrctl",
      "artifact": "docs/evidence/install-plan-20260905-local/install-plan-repeat.log",
      "sha256": "f0f1e9312bbb633de9dba59e14235597c4358f79a4bb2dfd4f605d8e3610b4c4"
    },
    {
      "id": "schema-cli-contract",
      "status": "PASS",
      "command": "make test-install-plan-schema",
      "artifact": "docs/evidence/install-plan-20260905-local/schema-cli-contract.log",
      "sha256": "9c0a5caabeb66dd731737bb8ccb21480ced141d91de83176a4149eec4aeadd36"
    },
    {
      "id": "input-fuzz",
      "status": "PASS",
      "command": "go test -run ^$ -fuzz ^FuzzDecode$ -fuzztime=10s -parallel=2 ./internal/installplan",
      "artifact": "docs/evidence/install-plan-20260905-local/input-fuzz.log",
      "sha256": "9de5d67f9d7e9d37413e1b8d867b8811634646739d592470951e3e9f57256b51"
    },
    {
      "id": "final-guard",
      "status": "PASS",
      "command": "make test-final [expected NO-GO exit 2; no final integration]",
      "artifact": "docs/evidence/install-plan-20260905-local/final-guard.log",
      "sha256": "6a5363431815a9249f820256b12e4bc765484aaea1294c964ba19645d38103e1"
    }
  ]
}
