{
  "schemaVersion": 1,
  "scope": "local",
  "runId": "recovery-20260905-local",
  "sourceDigest": "f9529923aa1d9b5543faa1815d8464c5dff78e9d094b54790caca6f70f2f0c80",
  "status": "PASS",
  "checks": [
    {
      "id": "foundation",
      "status": "PASS",
      "command": "make check",
      "artifact": "docs/evidence/recovery-20260905-local/foundation.log",
      "sha256": "6a0dbd8cab5148ce9376a1d3664a7325a42e3a5edd95926bcf1a55476d185152"
    },
    {
      "id": "admin-unit",
      "status": "PASS",
      "command": "go test -race -count=1 -v ./internal/adminauth/...",
      "artifact": "docs/evidence/recovery-20260905-local/admin-unit.log",
      "sha256": "760a9d8b9305263040bb1771e951027a17a7302d2343b430a51091eef517ed06"
    },
    {
      "id": "postgres-integration",
      "status": "PASS",
      "command": "make test-auth-db",
      "artifact": "docs/evidence/recovery-20260905-local/postgres-integration.log",
      "sha256": "978ad4a0987788fce200ce4297e78f46650346ab28af881d63f5f1684be53fdf"
    },
    {
      "id": "postgres-repeat",
      "status": "PASS",
      "command": "go test -tags=integration -race -count=10 -v -run ^TestPostgres ./internal/adminauth/pgstore",
      "artifact": "docs/evidence/recovery-20260905-local/postgres-repeat.log",
      "sha256": "28d9f41f8c7078caad3442a485b179072b7c796937a40273a6e7cd2f326b9431"
    },
    {
      "id": "recovery-repeat",
      "status": "PASS",
      "command": "go test -tags=integration -race -count=3 -v -run ^TestRecovery ./internal/adminauth/pgstore",
      "artifact": "docs/evidence/recovery-20260905-local/recovery-repeat.log",
      "sha256": "183ec27e75170bb9ac88859e7656851f844fad9661076603e784aac0685180b5"
    },
    {
      "id": "session-repeat",
      "status": "PASS",
      "command": "go test -tags=integration -race -count=10 -v -run ^TestSession ./internal/adminauth/pgstore ./internal/adminauth/sessionhttp",
      "artifact": "docs/evidence/recovery-20260905-local/session-repeat.log",
      "sha256": "68f5ea97c992133ba928d3757f0aff199eb5122843d95f90ccb2de9f1e2d5bf2"
    },
    {
      "id": "final-guard",
      "status": "PASS",
      "command": "make test-final [expected NO-GO exit 2]",
      "artifact": "docs/evidence/recovery-20260905-local/final-guard.log",
      "sha256": "6a5363431815a9249f820256b12e4bc765484aaea1294c964ba19645d38103e1"
    }
  ]
}
