{
  "schemaVersion": 1,
  "scope": "local",
  "runId": "m1-20260905-app-runtime",
  "sourceDigest": "97f48f2cbc81d413d3ed1321ff55d6f585894f620d401f9e824ff4cd50065bb5",
  "status": "FAIL",
  "checks": [
    {
      "id": "foundation",
      "status": "PASS",
      "command": "make check",
      "artifact": "docs/evidence/m1-20260905-app-runtime/foundation.log",
      "sha256": "16f6f724189bf8cd1151ddf547ff2c639faba56038df97a30fd3011caa833602"
    },
    {
      "id": "integration",
      "status": "PASS",
      "command": "make test-integration",
      "artifact": "docs/evidence/m1-20260905-app-runtime/integration.log",
      "sha256": "c3ab3abf6bd94e0fe488defb2d47dee8c5e47e15e4ce6990297e892ab5fc4181"
    },
    {
      "id": "restart",
      "status": "FAIL",
      "command": "make test-persistence",
      "artifact": "docs/evidence/m1-20260905-app-runtime/restart.log",
      "sha256": "07cd5e87370c01a8bd0d500c15271d95f9eb5af0eac6131fb3062b65eb672cb3"
    },
    {
      "id": "quick20",
      "status": "PASS",
      "command": "make lab-quick",
      "artifact": "docs/evidence/m1-20260905-app-runtime/quick20.log",
      "sha256": "9d076de6aa24012bd673b260b37c04d3208c155239a2e7b4ec229aea02177896"
    },
    {
      "id": "final-guard",
      "status": "PASS",
      "command": "make test-final [expected NO-GO exit 2]",
      "artifact": "docs/evidence/m1-20260905-app-runtime/final-guard.log",
      "sha256": "6a5363431815a9249f820256b12e4bc765484aaea1294c964ba19645d38103e1"
    }
  ]
}
