{
  "schemaVersion": 1,
  "scope": "local",
  "runId": "cost-estimate-20260905-local",
  "sourceDigest": "6b0a818a591ad76d475082b11aa679af0a094178df3820a3e99c69c9e05ae27d",
  "status": "PASS",
  "checks": [
    {
      "id": "foundation",
      "status": "PASS",
      "command": "make check",
      "artifact": "docs/evidence/cost-estimate-20260905-local/foundation.log",
      "sha256": "67b45a5397c24d95df33824a6f5a706f2696c4781e7824d7d6270ceac62bac79"
    },
    {
      "id": "install-plan-unit",
      "status": "PASS",
      "command": "go test -race -count=1 -json ./internal/installplan/... ./cmd/wrctl",
      "artifact": "docs/evidence/cost-estimate-20260905-local/install-plan-unit.log",
      "sha256": "d4ff3bf883a4a191478d837107c5009ecc3442dbd03c2beec0d8ea3d08b0501a"
    },
    {
      "id": "install-plan-repeat",
      "status": "PASS",
      "command": "go test -race -count=3 ./internal/installplan/... ./cmd/wrctl",
      "artifact": "docs/evidence/cost-estimate-20260905-local/install-plan-repeat.log",
      "sha256": "af3fc48fa3e97a6d9ac4b0955d6f101df994fcbc6ccc3fe275e2321642d15ddb"
    },
    {
      "id": "schema-cli-contract",
      "status": "PASS",
      "command": "make test-install-plan-schema",
      "artifact": "docs/evidence/cost-estimate-20260905-local/schema-cli-contract.log",
      "sha256": "eb49ce5457bb41b2f9f0c1381038a14663ffba6074df6b1445107b31648a7ac2"
    },
    {
      "id": "input-fuzz",
      "status": "PASS",
      "command": "go test -run ^$ -fuzz ^FuzzDecode$ -fuzztime=10s -parallel=2 ./internal/installplan",
      "artifact": "docs/evidence/cost-estimate-20260905-local/input-fuzz.log",
      "sha256": "13a053da240cd02346bb23ed4d918d6ca27e574443528141f92edfca7de13da2"
    },
    {
      "id": "clock-fuzz",
      "status": "PASS",
      "command": "go test -run ^$ -fuzz ^FuzzClockFailClosed$ -fuzztime=10s -parallel=2 ./internal/installplan/preflight",
      "artifact": "docs/evidence/cost-estimate-20260905-local/clock-fuzz.log",
      "sha256": "87095c1fee8d26f6fe5dff82ee3d8de5f67c9be684dd33247339e3874e6a0872"
    },
    {
      "id": "cost-fuzz",
      "status": "PASS",
      "command": "go test -run ^$ -fuzz ^FuzzCostArithmetic$ -fuzztime=10s -parallel=2 ./internal/installplan",
      "artifact": "docs/evidence/cost-estimate-20260905-local/cost-fuzz.log",
      "sha256": "71a5ab84be02ef909d1e5b0b4ef43a1516f948d155be1283821c36b9280c3c04"
    },
    {
      "id": "final-guard",
      "status": "PASS",
      "command": "make test-final [expected NO-GO exit 2; no final integration]",
      "artifact": "docs/evidence/cost-estimate-20260905-local/final-guard.log",
      "sha256": "6a5363431815a9249f820256b12e4bc765484aaea1294c964ba19645d38103e1"
    }
  ]
}
