{
  "schemaVersion": 1,
  "scope": "local",
  "runId": "m1-20260905-app-runtime-final",
  "sourceDigest": "8b7a915ce9f62c21ae6ae30311da11a7d9353a63b73e99338e4af89bff78ed1d",
  "status": "PASS",
  "checks": [
    {
      "id": "foundation",
      "status": "PASS",
      "command": "make check",
      "artifact": "docs/evidence/m1-20260905-app-runtime-final/foundation.log",
      "sha256": "efca99e977e2b5e4abcf9af5477120f360ffc6dbca9c860ec4404964e05fa21c"
    },
    {
      "id": "integration",
      "status": "PASS",
      "command": "make test-integration",
      "artifact": "docs/evidence/m1-20260905-app-runtime-final/integration.log",
      "sha256": "b01c8b72fe6a067346a4dfde45825c7973f1e0881fc945263b58a3028f169b2f"
    },
    {
      "id": "restart",
      "status": "PASS",
      "command": "make test-persistence",
      "artifact": "docs/evidence/m1-20260905-app-runtime-final/restart.log",
      "sha256": "b0c643cbb3b99f82e1f801ee7f46a3333ecbea560d2226a0b271b8cd8a84c1b2"
    },
    {
      "id": "quick20",
      "status": "PASS",
      "command": "make lab-quick",
      "artifact": "docs/evidence/m1-20260905-app-runtime-final/quick20.log",
      "sha256": "9d076de6aa24012bd673b260b37c04d3208c155239a2e7b4ec229aea02177896"
    },
    {
      "id": "final-guard",
      "status": "PASS",
      "command": "make test-final [expected NO-GO exit 2]",
      "artifact": "docs/evidence/m1-20260905-app-runtime-final/final-guard.log",
      "sha256": "6a5363431815a9249f820256b12e4bc765484aaea1294c964ba19645d38103e1"
    }
  ]
}
